{
  "namespace": "public",
  "packages": {
    "camera-service": {
      "kind": "service",
      "path": "services/camera-service",
      "version": "1.12.0"
    },
    "camera-service:siyi-zr30": {
      "kind": "profile",
      "path": "profiles/camera-service/siyi-zr30",
      "version": "1.0.2"
    },
    "mavlink-router": {
      "kind": "service",
      "path": "services/mavlink-router",
      "version": "0.1.0"
    },
    "ouster": {
      "kind": "service",
      "path": "services/ouster",
      "version": "0.5.2"
    },
    "ros1-bag-logger": {
      "kind": "service",
      "path": "services/ros1-bag-logger",
      "version": "1.19.0"
    },
    "ros2-bag-logger": {
      "kind": "service",
      "path": "services/ros2-bag-logger",
      "version": "1.19.0"
    },
    "ros2-bag-player": {
      "kind": "service",
      "path": "services/ros2-bag-player",
      "version": "1.19.0"
    },
    "sbg": {
      "kind": "service",
      "path": "services/sbg",
      "version": "0.11.0"
    },
    "zenoh-router": {
      "kind": "service",
      "path": "services/zenoh-router",
      "version": "1.19.0"
    }
  },
  "projects": {},
  "schema": 2,
  "sensors": {
    "siyi-zr30": [
      {
        "profile": "camera-service:siyi-zr30",
        "tier": "exact"
      }
    ],
    "zr30": [
      {
        "profile": "camera-service:siyi-zr30",
        "tier": "exact"
      }
    ]
  }
}
